{"artifacts":[{"bytes":2607,"path":"fixture-manifest.json","role":"fixture-manifest","sha256":"6a74e8627677c3c023871a6a8ccaf73e524a95fd0319d6aa2b7abc62ed3a3d2f"},{"bytes":440,"path":"host.json","role":"host-manifest","sha256":"e37e76a48e88d5751b32b026bfbd89fa08a855b87259ab781d116d97ede38aca"},{"bytes":192,"path":"report.md","role":"report","sha256":"331df7ba7837d374d8bef28406713ea070f7a04fc41c34f73301fa2cbb68e7b7"}],"bundle_class":"correctness","bundle_id":"sha256:311053f53efd9c28ab3e4338ca83e78e53acf8c969d9f8a76c6e56f7c2d79d86","checks":{"assembly":"not-applicable","certified_performance":"not-applicable","correctness":"pass","schema":"pass"},"created_utc":"2026-08-31T10:43:11Z","milestone":"g0","not_applicable":["assembly","certified_performance"],"project":{"compiler_version":"0.1.0","dirty":false,"format":"DFQ8_B32_V1","generated_abi":1,"numeric_mode":"strict_f32_v1","revision":"cc838b0b18d8d47c22a0665a81fcb7d12a04629d","runtime_abi":1},"reproduction":{"commands":[{"argv":["uv","run","--frozen","python","scripts/validate_schemas.py","--all"],"expected_exit_code":0,"id":"schema-contracts-v1"},{"argv":["uv","run","--frozen","python","scripts/generate_q8_fixtures.py","--check"],"expected_exit_code":0,"id":"q8-python-fixtures-v1"},{"argv":["make","rust-fixture-check"],"expected_exit_code":0,"id":"q8-rust-fixtures-v1"}],"cwd":".","environment":{"CARGO_NET_OFFLINE":"true","DECODEFORGE_SOURCE_REVISION":"cc838b0b18d8d47c22a0665a81fcb7d12a04629d","UV_OFFLINE":"true"},"policy":"g0-correctness-v1","source_revision":"cc838b0b18d8d47c22a0665a81fcb7d12a04629d"},"schema_version":1,"target":{"features":["neon"],"triple":"aarch64-apple-darwin"}}